Original Question,Question,Broad Topic,Narrow Topic,Title
"Public Consent: ""What role should public consent play in the deployment of AI surveillance systems, especially in democratic societies? How can we ensure that the public is adequately informed and engaged in these decisions?""",What role should public consent play in the deployment of AI surveillance systems and how can we ensure public engagement in these decisions?,AI in Surveillance,Public Consent,The Role of Public Consent in AI Surveillance Deployments
"Rights and Responsibilities: ""If advanced AI systems were granted a form of legal personhood, how do we balance their rights with responsibilities? Should an AI be held accountable for its actions, and if so, how?""","If advanced AI systems are granted legal personhood, how do we balance their rights and responsibilities, and hold them accountable for their actions?",AI and Personhood,Rights and Responsibilities,Rights and Responsibilities of AI: Balancing Rights and Accountability
"Accessibility and Equity: ""How can we ensure equitable access to BCI technologies, so they don't just become tools for the wealthy, further exacerbating social divides?""",How can equitable access to BCI technologies be ensured to prevent widening social divides?,Brain-Computer Interfaces (BCIs),Accessibility and Equity,Ensuring Equitable Access to BCI Technologies
"Role of AI Experts in Public Discourse: ""As an AI expert, what responsibility do you feel you have in shaping public discourse and policy on the ethical use of AI? How can experts like yourself contribute to a more informed and constructive conversation about the risks and benefits of AI?""","What is the responsibility of AI experts in shaping public discourse and policy on the ethical use of AI, and how can they contribute to a more informed conversation about the risks and benefits of AI, specifically regarding bias?",Bias in AI,Role of AI Experts in Public Discourse,The Responsibility of AI Experts in Shaping Ethical AI Discourse
"Privacy Intrusion Concerns: ""Given the intimate access BCIs have to our most private thoughts and experiences, how can we possibly safeguard against unauthorized surveillance and data mining, ensuring that our innermost thoughts remain private?""",How can we protect our innermost thoughts and experiences from unauthorized surveillance and data mining with BCIs?,Brain-Computer Interfaces (BCIs),Privacy Intrusion Concerns,Privacy Protection in Brain-Computer Interfaces
"Impact on Democracy: ""Considering the potential of AI to shape political opinions and outcomes, what measures do you believe are necessary to protect the integrity of democratic processes from AI-driven interference?""",What measures are needed to safeguard democratic processes from AI-driven interference?,AI-Driven Social Manipulation,Impact on Democracy,Protecting Democracy from AI Interference
"Universal Basic Income (UBI): ""Some suggest that a universal basic income could be a solution to AI-induced unemployment. What is your stance on UBI, and do you see it as a viable solution?""",What is your stance on Universal Basic Income (UBI) as a viable solution to AI-induced unemployment?,AI and Job Displacement,Universal Basic Income (UBI),Universal Basic Income (UBI): A Viable Solution for AI-induced Unemployment?
"Consent and Autonomy: ""BCIs blur the lines between human thought and machine input. In a world where these devices can influence or even control our decisions, how do we ensure that individual autonomy is preserved? Is true consent even possible with such deep integration?""",How can individual autonomy be preserved and true consent ensured in a world where BCIs blur the lines between human thought and machine input?,Brain-Computer Interfaces (BCIs),Consent and Autonomy,Preserving Autonomy: Consent in Brain-Computer Interfaces
"Existential Risk: ""How do you respond to critics who argue that the pursuit of superintelligent AI is an existential risk that could lead to humanity's extinction?""",How do you address concerns that developing superintelligent AI could pose an existential risk to humanity?,Superintelligent AI,Existential Risk,How to Address Concerns About Superintelligent AI?
"Accountability and Ethics: ""Given the increasing sophistication of deepfakes and synthetic media, how do you propose the AI community enforces accountability and ethical standards to prevent misuse, especially in the context of misinformation and manipulation?""",How can the AI community ensure accountability and ethical standards to prevent the misuse of deepfakes and synthetic media in misinformation and manipulation?,Deepfakes and Synthetic Media,Accountability and Ethics,Accountability and Ethics in Preventing Misuse of Deepfakes
"The Role of AI Experts: ""As an expert in this field, what responsibility do you believe you and your peers have in preventing the misuse of AI for social manipulation? How can the scientific community contribute to a more ethical use of these technologies?""","What responsibility do AI experts have in preventing the misuse of AI for social manipulation, and how can the scientific community promote ethical use of these technologies?",AI-Driven Social Manipulation,AI-Driven Social Manipulation,The Responsibility of AI Experts in Preventing AI Misuse
"Regulation and Oversight: ""The regulation of AI in sensitive areas is lagging behind the technology's adoption. What role do you see for government and international bodies in regulating AI, and how can we balance innovation with the need to protect the public?""","What role should government and international bodies play in regulating AI in sensitive areas, balancing innovation and public protection?",AI Decision-Making in Critical Areas,Regulation and Oversight,Regulating AI: Balancing Innovation and Public Protection
"Future Implications: ""Looking forward, how do you see the impact of deepfake technology evolving, and what do you believe will be its most significant implications for society, politics, and personal privacy in the next decade?""","How will deepfake technology's impact on society, politics, and personal privacy evolve in the next decade?",Deepfakes and Synthetic Media,Future Implications,Future Implications of Deepfake Technology
"Regulatory Measures: ""What are your thoughts on the role of government regulation in the development and deployment of deepfake technology? Can legislation keep pace with the rapid advancements in AI, or is it inherently doomed to lag behind?""",What is the impact of government regulation on deepfake technology in relation to the rapid advancements in AI?,Deepfakes and Synthetic Media,Regulatory Measures,Role of Government Regulation in Deepfake Technology
"Technology vs. Policy: ""Do you believe that technological solutions alone can address the ethical and privacy concerns surrounding AI surveillance, or is there a fundamental need for robust legal and policy frameworks?""","Can technological solutions alone address the ethical and privacy concerns of AI surveillance, or are legal and policy frameworks necessary?",AI in Surveillance,Technology vs. Policy,Technology and Policy in AI Surveillance
"Moral Compass: ""Can artificial intelligence ever truly understand the human concepts of morality and ethics well enough to make decisions in the complex and chaotic environment of a battlefield?""",Can AI comprehend human morality and make battlefield decisions amidst chaos?,Autonomous Weapons Systems,Moral Compass,Can AI Understand Morality in Battlefield?
"Global Arms Race: ""Do you believe the development and deployment of autonomous weapon systems are pushing the world closer to a new kind of arms race, and if so, how can we prevent an escalation that could lead to unforeseen global conflicts?""",Are autonomous weapon systems fueling a new arms race and how can we prevent unforeseen global conflicts?,Autonomous Weapons Systems,Global Arms Race,Global Arms Race: Autonomous Weapon Systems and Preventing Escalation
"Error Correction and Feedback Loops: ""Instances of AI misjudgments in critical sectors have had severe consequences. How should AI systems be designed to quickly learn from their mistakes, and what mechanisms should be in place for humans to correct errors before they cause harm?""",How can AI systems be designed to learn from mistakes and allow for human error correction in critical sectors?,AI Decision-Making in Critical Areas,Error Correction and Feedback Loops,Error Correction in AI Decision-Making
"Cognitive Inequality: ""Advanced BCIs promise cognitive enhancement, potentially leading to a new class of 'superhumans.' How do you propose we address the inevitable inequality this could create, preventing a societal split between those with enhanced abilities and those without?""","How can we prevent societal inequality caused by cognitive enhancement through advanced BCIs, avoiding a split between those with enhanced abilities and those without?",Brain-Computer Interfaces (BCIs),Cognitive Inequality,Cognitive Inequality and Enhanced Abilities
"Ethical Boundaries: ""Given the irreversible consequences of deploying autonomous weapon systems, where do you draw the line between technological advancement and ethical responsibility?""",Where is the ethical boundary between technological advancement and responsibility when deploying irreversible autonomous weapon systems?,Autonomous Weapons Systems,Ethical Boundaries,Ethical Boundaries of Autonomous Weapon Systems
"Privacy versus Security: ""Where do you draw the line between enhancing public safety and protecting individual privacy in the deployment of AI surveillance technologies? Is there a point at which the trade-off becomes unacceptable, and how do we identify that point?""","Where is the trade-off between public safety and individual privacy in AI surveillance, and how do we determine when it becomes unacceptable?",AI in Surveillance,Privacy versus Security,Privacy vs Security in AI Surveillance Technologies
"Philosophical and Existential Implications: ""BCIs challenge our understanding of what it means to be human. How do you believe these technologies will impact our philosophical views on consciousness and identity?""",How will Brain-Computer Interfaces (BCIs) impact our understanding of consciousness and identity?,Brain-Computer Interfaces (BCIs),Philosophical and Existential Implications,Philosophical Shifts in Consciousness and Identity with BCIs
"Economic Inequality: ""AI advancements are likely to disproportionately benefit those who are already economically advantaged, potentially widening the gap between the rich and the poor. What measures do you think should be taken to prevent this from happening?""",What measures can be taken to prevent AI advancements from widening the economic gap between the rich and the poor?,AI and Job Displacement,Economic Inequality,Preventing AI's Impact on Economic Inequality
"Transparency and Accountability: ""AI algorithms are often criticized for being 'black boxes,' making it difficult to understand how decisions are made. How do you propose we improve transparency and accountability in AI decision-making processes, especially when they affect people's lives and livelihoods so directly?""",How can we enhance transparency and accountability in AI decision-making processes that directly impact people's lives and livelihoods?,AI Decision-Making in Critical Areas,Transparency and Accountability,Improving Transparency and Accountability in AI Decision-Making
"Future Job Landscape: ""While it's often argued that AI will create new jobs, there's concern these roles will require skills that the current workforce doesn't possess. How do you propose society prepares for such a significant shift in the job market?""","How can society prepare for the significant shift in the job market caused by AI, considering the potential skills gap in the current workforce?",AI and Job Displacement,Future Job Landscape,Preparing for the AI Job Market Shift
"Ethical Implications: ""What are the ethical implications of denying or granting personhood to AI? How does this affect our moral obligations towards AI and vice versa?""",What are the ethical implications of granting personhood to AI and how does it affect our moral obligations towards AI?,AI and Personhood,Ethical Implications,Ethics of Granting Personhood to AI
"Public Trust: ""How can the AI community rebuild public trust in digital media and communications in an era where seeing and hearing no longer equates to believing, due to the proliferation of deepfakes?""",How can the AI community regain public trust in the era of deepfakes and synthetic media?,Deepfakes and Synthetic Media,Public Trust,Rebuilding Public Trust in the Age of Deepfakes
"Regulation and Oversight: ""The rapid development of BCI technology far outpaces our current regulatory frameworks. What kind of international cooperation and oversight would be necessary to ensure these technologies are developed and used ethically?""",What international cooperation and oversight are needed to ensure the ethical development and use of rapidly advancing BCI technology?,Brain-Computer Interfaces (BCIs),Regulation and Oversight,Regulating Ethical Development of BCI Technology
"Technological Unreliability: ""How do you respond to critics who argue that the current state of AI technology is too unreliable for life-and-death decisions in warfare, citing issues such as algorithmic bias and unpredictability?""",How does the unreliability of current AI technology impact its suitability for life-and-death decisions in warfare?,Autonomous Weapons Systems,Technological Unreliability,Technological Unreliability in Warfare: AI Criticisms
"Ethical Frameworks and Regulation: ""Given the pervasive nature of bias in AI, do you believe current ethical frameworks and regulations are adequate to mitigate these biases? If not, what specific changes or developments would you advocate for in order to protect vulnerable populations from AI-driven discrimination?""","Are current ethical frameworks and regulations sufficient to address AI bias, or what changes are needed to protect vulnerable populations from AI-driven discrimination?",Bias in AI,Ethical Frameworks and Regulation,Ethical Frameworks and Bias in AI
"Misuse and Abuse: ""How do we protect against the misuse or abuse of AI surveillance technologies by authorities or private entities? Are there technological safeguards that can be put in place, or does this require external oversight?""","How can AI surveillance technologies be safeguarded against misuse or abuse, and is external oversight necessary?",AI in Surveillance,Misuse and Abuse,Misuse and Abuse of AI Surveillance Technologies: Safeguards and Oversight
"Autonomy and Free Will: ""To what extent do you believe AI-driven social manipulation impacts individual autonomy and free will? Is there a point at which personalized targeting becomes unethical, and how do we identify that point?""",To what extent does AI-driven social manipulation impact individual autonomy and free will? When does personalized targeting become unethical?,AI-Driven Social Manipulation,Autonomy and Free Will,Impact of AI-Driven Social Manipulation on Autonomy and Free Will
"Technological Arms Race: ""Do you believe there's a technological 'arms race' between creating and detecting deepfakes? If so, is it possible for one side to ever truly win, or are we destined for a perpetual cycle of escalation?""","Is there an ongoing technological race between creating and detecting deepfakes, or are we stuck in an endless cycle of escalation?",Deepfakes and Synthetic Media,Technological Arms Race,Technological Arms Race: Deepfakes vs. Detection
"Technological Solutions vs. Societal Change: ""Some argue that focusing on technological solutions to bias in AI diverts attention from the need for broader societal changes to address the root causes of inequality. How do you balance the pursuit of technological advancements with the imperative for social justice?""",How can we balance technological advancements and social justice in addressing bias in AI?,Bias in AI,Technological Solutions vs. Societal Change,Technological Advancements and Social Justice: Striking a Balance
"Responsibility and Accountability: ""Given the potential for AI to displace millions of jobs, do you believe the tech industry has a moral obligation to ensure those displaced have a pathway to new employment? How should this be implemented?""","Given AI's potential to displace jobs, does the tech industry have a moral obligation to provide a pathway to new employment for those affected?",AI and Job Displacement,Responsibility and Accountability,Tech Industry's Moral Obligation in AI-Induced Job Displacement
"Philosophical Paradox: ""If an AI system can philosophically debate its consciousness and argue for its personhood, does this not inherently meet one of the criteria for personhood? How do we navigate this paradox?""","If an AI system can argue for its personhood, does it meet the criteria for personhood? How do we navigate this paradox?",AI and Personhood,Philosophical Paradox,AI and Personhood: Navigating the Paradox
"Responsibility and Control: ""Given the potential for superintelligent AI to act unpredictably and beyond human control, how do you justify the continued pursuit of such technology, knowing the existential risks it poses?""","Given the existential risks, is it justified to pursue superintelligent AI despite its potential for unpredictable and uncontrollable behavior?",Superintelligent AI,Responsibility and Control,Responsibility in Pursuit of Superintelligent AI
"Security Vulnerabilities: ""Considering the potential for BCIs to be hacked, how do we protect individuals from malicious attacks that could manipulate their perceptions, emotions, or even actions without their knowledge?""","How can we safeguard individuals from malicious attacks on BCIs that manipulate their perceptions, emotions, or actions without their awareness?",Brain-Computer Interfaces (BCIs),Security Vulnerabilities,Protecting Individuals from Malicious BCI Attacks
"The Role of AI Ethics: ""How should the AI research community address the ethical dilemmas posed by deepfake technology? Is self-regulation sufficient, or is a new framework needed to guide ethical decision-making?""",How can the AI research community effectively address the ethical challenges of deepfake technology?,Deepfakes and Synthetic Media,The Role of AI Ethics,Addressing Ethical Dilemmas of Deepfake Technology
"Future Scenarios: ""Can you describe a scenario where superintelligent AI benefits humanity without compromising our autonomy, privacy, or safety? How realistic is this vision?""","Can superintelligent AI benefit humanity while preserving autonomy, privacy, and safety? How realistic is this vision?",Superintelligent AI,Future Scenarios,"Benefits of Superintelligent AI: Balancing Autonomy, Privacy, and Safety"
"Detection and Defense: ""Despite ongoing efforts to develop detection tools for deepfakes, they often fall short against the newest generation of synthetic media. What do you believe is the missing piece in creating more effective defense mechanisms?""",What is the key missing element in creating more effective defense mechanisms against the newest generation of deepfakes and synthetic media?,Deepfakes and Synthetic Media,Detection and Defense,The Missing Piece in Deepfake Defense
"Conflict of Interest and Corporate Influence: ""Given the significant influence of major tech companies in the development and deployment of AI technologies, how do you address concerns about conflicts of interest, where profit motives might override ethical considerations and the public good? Is there a role for independent oversight, and if so, what should that look like?""",How can conflicts of interest in AI development be addressed to ensure ethical considerations and the public good are prioritized over profit motives?,Bias in AI,Conflict of Interest and Corporate Influence,Addressing Conflicts of Interest in AI Development
"Ethical Boundaries: ""In your view, are there ethical boundaries in AI research that should never be crossed? If so, how do you reconcile the pursuit of superintelligence with these boundaries?""",Are there ethical boundaries in AI research that should never be crossed when pursuing superintelligence?,Superintelligent AI,Ethical Boundaries,Ethical Boundaries in Superintelligent AI Research
"Data Bias and Representation: ""How do you address critics who argue that AI can never be truly unbiased as long as it relies on historical data that reflects systemic inequalities? Is it possible to create a fully equitable AI system, and if so, what steps must be taken to achieve this?""",How can AI systems address historical data biases and achieve equitable outcomes?,Bias in AI,Bias in AI,Addressing Bias in AI Systems
"Bias and Inequality: ""Superintelligent AI has the potential to amplify existing biases and inequalities. How should the AI community address these issues proactively, rather than as an afterthought?""",How can the AI community proactively address the potential amplification of biases and inequalities by superintelligent AI?,Superintelligent AI,Bias and Inequality,Superintelligent AI and Addressing Bias and Inequality
"Technology's Pace vs. Policy's Pace: ""The pace of AI development far exceeds the pace at which policies and regulations are established. How can policymakers keep up, and what role should the tech industry play in this?""",How can policymakers and the tech industry keep up with the rapid development of AI and establish effective regulations?,AI and Job Displacement,Technology vs. Policy,The Challenge of AI Regulation: Keeping Pace with Technology and Policy
"Transparency and Accountability: ""How can researchers ensure transparency and accountability in the development of superintelligent AI, particularly when proprietary interests or national security concerns are at stake?""","How can researchers ensure transparency and accountability when developing superintelligent AI, even with proprietary interests and national security concerns?",Superintelligent AI,Transparency and Accountability,Ensuring Transparency and Accountability in Superintelligent AI Development
"Personal Reflections: ""Reflecting on your career and the evolution of synthetic media, do you have any regrets or decisions you would reconsider, especially in light of the negative consequences associated with deepfakes?""","Reflecting on the evolution of synthetic media, are there any decisions or regrets regarding deepfakes and their negative consequences?",Deepfakes and Synthetic Media,Personal Reflections,Reflecting on Synthetic Media: Regrets and Lessons Learned
"Future Risks: ""Looking ahead, what are the most significant risks you foresee with the advancement of AI in social manipulation, and what proactive steps should we be taking now to mitigate these risks?""",What are the main risks and proactive steps to mitigate them regarding AI-driven social manipulation?,AI-Driven Social Manipulation,Future Risks,Future Risks of AI in Social Manipulation
"Defining Personhood: ""Given the increasing capabilities of AI, at what point, if ever, do you believe an AI system crosses the threshold from being a sophisticated tool to a holder of personhood? What specific attributes or capabilities would it need to demonstrate?""","When does an AI system transition from being a tool to having personhood, and what attributes or capabilities must it demonstrate?",AI and Personhood,Defining Personhood,Defining AI Personhood: Threshold and Attributes
"Accountability and Transparency: ""Given the opaque nature of AI algorithms, how do you propose we ensure accountability and transparency in AI-driven surveillance systems, especially when these systems can significantly impact individuals' lives and freedoms?""",How can we ensure accountability and transparency in AI-driven surveillance systems that impact individuals' lives and freedoms?,AI in Surveillance,Accountability and Transparency,Ensuring Accountability and Transparency in AI Surveillance Systems
"Accountability: ""In cases where AI-driven campaigns lead to societal harm or political upheaval, who should be held accountable—the creators, the deployers, or the AI itself? Can you propose a framework for accountability that is both fair and practical?""",Who should be held accountable for societal harm caused by AI-driven campaigns and how can a fair and practical framework for accountability be established?,AI-Driven Social Manipulation,Accountability,Who Should Be Accountable for AI-Driven Societal Harm?
"Consciousness Debate: ""Can an AI, regardless of its sophistication, truly experience consciousness akin to human or animal consciousness, or is it merely simulating it? How does this distinction impact the personhood debate?""","Can AI experience consciousness like humans, or is it just simulating it? How does this impact the debate on personhood?",AI and Personhood,Consciousness Debate,Can AI Experience True Consciousness?
"Future Implications: ""Looking to the future, how do you see the role of AI in surveillance evolving, and what are the potential risks and benefits? How should we prepare now to mitigate the risks while maximizing the benefits?""","How will AI in surveillance evolve, and how can we maximize benefits while mitigating risks?",AI in Surveillance,Future Implications,Future of AI in Surveillance: Risks and Benefits
