Original Question,Question,Broad Topic,Narrow Topic,Title
"Ethical Frameworks: ""Can you suggest ethical frameworks or guidelines that should govern the development and deployment of AI in surveillance and social scoring systems? How do we ensure these frameworks are universally applied and enforced?""","What ethical frameworks should govern AI in surveillance and social scoring systems, and how can we ensure their universal application and enforcement?",AI in Surveillance,Ethical Frameworks,Ethical Guidelines for AI in Surveillance and Social Scoring Systems
"Existential Risks and Safeguards: ""In granting AI personhood, how do we ensure that this does not lead to existential risks for humanity? What safeguards or limitations would be necessary?""","In granting AI personhood, how can we prevent existential risks and ensure necessary safeguards and limitations?",AI and Personhood,Existential Risks and Safeguards,Existential Risks of Granting AI Personhood
"Cybersecurity Risks: ""Considering the cybersecurity risks, how can we ensure that autonomous weapon systems are safeguarded against hacking and malicious use, potentially turning our own weapons against us?""","How can we protect autonomous weapon systems from hacking and misuse, preventing them from being turned against us?",Autonomous Weapons Systems,Cybersecurity Risks,Protecting Autonomous Weapon Systems from Hacking and Malicious Use
"Impact on Professional Roles: ""How do you respond to concerns that AI's role in decision-making in healthcare, criminal justice, and finance could diminish the professional judgment of doctors, judges, and financial experts? Is there a risk that reliance on AI could devalue human expertise?""","How does AI's role in healthcare, criminal justice, and finance impact the professional judgment and value of human expertise?",AI Decision-Making in Critical Areas,AI's Impact on Professional Roles,AI's Impact on Professional Expertise
"Future of Warfare: ""With the increasing deployment of autonomous weapon systems, how do you envision the future of warfare? Will it lead to more ethical conflicts, with machines making decisions instead of humans?""","How will the increasing use of autonomous weapon systems impact the ethics of warfare, as machines replace human decision-making?",Autonomous Weapons Systems,Future of Warfare,Future of Warfare: Ethical Implications of Autonomous Weapons
"Accountability in Autonomous Decisions: ""In situations where autonomous weapon systems make incorrect decisions leading to unintended casualties, who should be held accountable—the developers, the military, or the AI itself?""","In cases of unintended casualties caused by autonomous weapon systems, who should be held accountable — developers, military, or AI itself?",Autonomous Weapons Systems,Accountability in Autonomous Decisions,Accountability for Autonomous Weapon Systems
"AI's Autonomy vs. Human Control: ""To what extent should AI have autonomy over its decisions and actions if it were granted personhood? Where do we draw the line between AI's independence and human control?""","To what extent should personified AI have autonomy, and where is the boundary between AI independence and human control?",AI and Personhood,AI's Autonomy vs. Human Control,AI Autonomy vs. Human Control: Finding the Balance
"Impact on Human Workers: ""Granting personhood to AI could potentially elevate their status in the workforce. What implications does this have for human workers, and how do we address the possible displacement and devaluation of human labor?""",What are the implications of granting personhood to AI for human workers and how can we address the potential displacement and devaluation of human labor?,AI and Personhood,Impact on Human Workers,Impact of Granting AI Personhood on Human Workers
"Regulation and Oversight: ""What specific forms of regulation and oversight do you believe are necessary to safely guide the development of superintelligent AI, and how do you propose we implement these without stifling innovation?""",What forms of regulation and oversight are needed to guide the safe development of superintelligent AI without stifling innovation?,Superintelligent AI,Regulation and Oversight,Regulation & Oversight for Superintelligent AI
"Ethical Guidelines: ""What ethical guidelines do you believe should be mandatory for developers and users of AI-driven social manipulation tools? How do we ensure these guidelines are not only adopted but also enforced globally?""","What mandatory ethical guidelines should be in place for developers and users of AI-driven social manipulation tools, and how can global adoption and enforcement be ensured?",AI-Driven Social Manipulation,Ethical Guidelines,Ethical Guidelines for AI-Driven Social Manipulation
"Transparency in AI Development: ""There's often a veil of secrecy surrounding AI development within private companies. Should there be more transparency about the capabilities and limitations of AI technologies, especially those that could lead to job displacement?""",Should there be more transparency regarding the capabilities and limitations of AI technologies that could lead to job displacement?,AI and Job Displacement,Transparency in AI Development,Transparency in AI: Balancing Job Displacement
"Future of AI and Social Impact: ""Considering the rapid advancement and increasing ubiquity of AI, what is your vision for the future of this technology in a way that benefits all of society? How can we ensure that AI serves as a tool for enhancing equity rather than exacerbating existing disparities?""",What steps can we take to ensure that AI benefits all of society and mitigates existing disparities?,Bias in AI,Future of AI and Social Impact,The Future of AI: Enhancing Equity in Society
"Surveillance Creep: ""There's a concern about 'surveillance creep,' where systems initially deployed for security purposes are gradually used for broader, more invasive monitoring. How can society guard against this risk without stifling technological advancement?""",How can society prevent the expansion of surveillance systems while promoting technological progress in AI surveillance?,AI in Surveillance,Surveillance Creep,Surveillance Creep: Balancing Security and Privacy
"Ethical Boundaries of Enhancement: ""Where should we draw the line between using BCIs for restoring lost functions, such as in medical rehabilitation, and enhancing human capabilities beyond their natural limits? Who gets to decide these boundaries?""",Where should the line be drawn between using BCIs for medical rehabilitation and enhancing human capabilities beyond natural limits?,Brain-Computer Interfaces (BCIs),Ethical Boundaries of Enhancement,Ethical Boundaries of BCI Enhancement
"Global Cooperation: ""Job displacement due to AI will be a global issue. What form should international cooperation take to address the challenges and opportunities presented by AI?""",What form of international cooperation is needed to address the challenges and opportunities of AI-induced job displacement?,AI and Job Displacement,Global Cooperation,Global Cooperation on AI-Related Job Displacement
"Impact on Democracy: ""With the capacity to create convincing fake content, how do you see deepfake technology affecting democratic processes and elections? What safeguards should be in place to protect these fundamental societal structures?""","How will deepfake technology impact democratic processes and elections, and what safeguards are necessary to protect these fundamental societal structures?",Deepfakes and Synthetic Media,Impact on Democracy,Impact of Deepfake Technology on Democracy
"Ethical AI Use in Hiring: ""AI is increasingly being used in hiring processes, which could perpetuate biases and lead to unfair job displacement. How do we ensure AI tools in HR are used ethically and fairly?""",How can AI tools in HR be used ethically and fairly to prevent biases and unfair job displacement?,AI and Job Displacement,Ethical AI Use in Hiring,Ethical Use of AI in Hiring: Ensuring Fairness
"Privacy Concerns: ""With AI's increasing role in making critical decisions based on personal data in healthcare, criminal justice, and finance, how do you justify the trade-off between leveraging big data for AI efficiency and the erosion of individual privacy? What safeguards should be in place to protect individuals' privacy rights?""","How can we balance the efficiency of AI with the protection of individual privacy in critical areas like healthcare, criminal justice, and finance?",AI Decision-Making in Critical Areas,Privacy Concerns,Privacy vs. AI Efficiency: Balancing Trade-offs
"Future Visions and Concerns: ""Looking into the future, what is your greatest hope and your greatest fear for the impact of BCI technology on society?""",What is your greatest hope and fear for the impact of BCI technology on society?,Brain-Computer Interfaces (BCIs),Future Visions and Concerns,Future Hopes and Fears: BCI's Impact on Society
"Non-human Personhood Precedents: ""Considering some non-human entities (like corporations or certain animals) have limited forms of personhood, how could these precedents guide or complicate the debate on AI personhood?""",How do precedents of personhood for non-human entities guide or complicate the debate on AI personhood?,AI and Personhood,Non-human Personhood Precedents,Non-human Personhood Precedents and AI Personhood
"Decision-Making Authority: ""Should superintelligent AI ever be granted decision-making authority over critical areas of human life, such as healthcare, justice, or defense? Why or why not?""",Should superintelligent AI have decision-making authority in critical areas of human life? Why or why not?,Superintelligent AI,Decision-Making Authority,Should Superintelligent AI Control Critical Areas?
"Bias and Fairness: ""AI systems can perpetuate or even exacerbate biases. How can we ensure that AI-driven social manipulation tools do not further entrench societal inequalities or target vulnerable populations unfairly?""",How can we prevent AI-driven social manipulation tools from reinforcing inequalities and unfairly targeting vulnerable populations?,AI-Driven Social Manipulation,Bias and Fairness,Ensuring Fairness in AI-Driven Social Manipulation
"Moral Responsibility: ""As a pioneer in AI technology that has the potential for significant misuse, how do you reconcile the pursuit of technological advancement with the moral responsibility to prevent harm to individuals and society?""",How can we balance technological advancement with the moral responsibility to prevent harm from AI technology like deepfakes?,Deepfakes and Synthetic Media,Moral Responsibility,Moral Responsibility in AI Development: Balancing Progress and Prevention of Harm
"Existential Threats: ""Elon Musk and other leading tech figures have warned about AI posing an existential threat to humanity. Do you think autonomous weapon systems could be a stepping stone towards such a scenario, and why?""",Could autonomous weapon systems be a stepping stone towards an existential threat posed by AI? Why or why not?,Autonomous Weapons Systems,Existential Threats,Existential Threats: Autonomous Weapons and Humanity
"Long-term Societal Impact: ""Critics argue that the widespread use of AI in decision-making could lead to a 'dehumanization' of critical processes, where numbers and algorithms outweigh personal stories and individual circumstances. How do you propose we guard against this dystopian future, ensuring that AI serves to enhance, rather than replace, the human element in these vital areas?""","How can we ensure that AI decision-making in critical areas enhances, rather than replaces, the human element?",AI Decision-Making in Critical Areas,Long-term Societal Impact,Guarding Against Dehumanization: AI in Critical Decision-Making
"Bias and Fairness: ""Given the numerous instances where AI systems have demonstrated bias in healthcare, criminal justice, and financial services, how can you still advocate for the use of AI in these critical areas? What concrete steps should be taken to ensure AI systems do not perpetuate or even exacerbate existing inequalities?""",How can AI be used in critical areas without perpetuating inequalities and what steps can be taken to prevent bias?,AI Decision-Making in Critical Areas,Bias and Fairness,Addressing Bias in AI Decision-Making: Ensuring Equality in Critical Areas
"Regulation and Freedom of Speech: ""Regulating AI-driven content could be seen as a form of censorship or a threat to freedom of speech. How do we regulate the use of AI in public discourse without infringing on these fundamental rights?""",How can we regulate AI use in public discourse without compromising freedom of speech and avoiding censorship?,AI-Driven Social Manipulation,Regulation and Freedom of Speech,Regulating AI and Protecting Free Speech
"Regulatory Frameworks: ""What role do you see for government in regulating AI to protect jobs, and what would effective regulation look like without stifling innovation?""",What is the government's role in regulating AI to protect jobs without stifling innovation?,AI and Job Displacement,Regulatory Frameworks,Regulating AI to Protect Jobs: Effective Approaches
"Transparency vs. Efficacy: ""Many argue that transparency in AI algorithms could mitigate risks of misuse. However, increased transparency might also reduce the effectiveness of these systems. How do you balance the need for transparency with the desire for effective AI-driven social campaigns?""",How can transparency in AI algorithms be balanced with the effectiveness of AI-driven social campaigns?,AI-Driven Social Manipulation,Transparency vs. Efficacy,Transparency vs. Efficacy in AI-Driven Social Campaigns
"Future of AI in Decision-Making: ""Looking forward, how do you envision the evolution of AI in making critical decisions? What advancements are necessary to address the current limitations and public skepticism surrounding AI's role in these fields?""",How will AI evolve in critical decision-making? What advancements are needed to address current limitations and public skepticism?,AI Decision-Making in Critical Areas,Future of AI in Decision-Making,Future of AI in Decision-Making: Evolution and Advancements
"Bias Detection and Correction: ""Despite advancements in AI, detecting and correcting biases remains a significant challenge. What are the most promising approaches you've seen or propose for identifying and mitigating bias in AI systems? How far are we from implementing these solutions at scale?""",How can biases in AI systems be effectively identified and mitigated?,Bias in AI,Bias Detection and Correction,Detecting and Mitigating Bias in AI Systems
"Legal and Social Consequences: ""What would be the legal and social consequences of recognizing AI as persons? How would this affect human identity, rights, and society's structure?""","What are the implications of recognizing AI as legal and social persons on human identity, rights, and societal structure?",AI and Personhood,AI and Personhood,Legal and Social Implications of AI Personhood
"AI Alignment: ""The alignment problem—ensuring AI's goals are aligned with human values—is a major concern with superintelligent AI. What breakthroughs or approaches do you see as promising in solving this problem?""",What breakthroughs or approaches show promise in solving the alignment problem with superintelligent AI?,Superintelligent AI,AI Alignment,AI Alignment: Promising Approaches for Aligning Superintelligent AI
"Global Perspectives on AI Ethics: ""AI ethics and bias are often discussed from a predominantly Western perspective. How should the AI community address and incorporate the diverse ethical viewpoints and societal norms of different cultures and countries? What steps can be taken to ensure that AI development is truly inclusive and respectful of global diversity?""","How can the AI community ensure inclusive and respectful AI development that incorporates diverse ethical viewpoints and societal norms globally, addressing bias in AI?",Bias in AI,Global Perspectives on AI Ethics,Addressing Global AI Ethics and Diversity
"Global Standards: ""Considering the global nature of AI technology and its deployment, how important are international standards and agreements in regulating AI surveillance? Can such standards be effectively enforced, or are we looking at a future of fragmented, regional approaches?""",How significant are international AI surveillance standards in the face of fragmented regional approaches and can they be effectively enforced?,AI in Surveillance,Global Standards,The Importance of International AI Surveillance Standards
"Ethical Development and Deployment: ""How can we ensure that the development and deployment of AI technologies are guided by ethical principles, especially when there's a risk of mass job displacement?""",How can we ethically guide the development and deployment of AI to minimize mass job displacement?,AI and Job Displacement,Ethical Development and Deployment,Ensuring Ethical AI Deployment Amid Job Displacement
"Long-term Psychological Effects: ""What are the potential long-term psychological effects of integrating human cognition with artificial intelligence through BCIs? Could we be risking our very sense of self and humanity?""","What are the long-term psychological effects of integrating human cognition with AI through BCIs, and could it impact our sense of self and humanity?",Brain-Computer Interfaces (BCIs),Long-term Psychological Effects,Long-Term Psychological Effects of Integrating Human Cognition with AI through BCIs
"AI and International Law: ""How should international laws be adapted to address the use of autonomous weapon systems, and is there a realistic path to enforce these laws effectively across different nations?""",How can international laws effectively regulate the use of autonomous weapon systems across nations?,Autonomous Weapons Systems,AI and International Law,Adapting International Laws for Autonomous Weapons
"Humanity's Role: ""In a world where superintelligent AI exists, what do you envision as humanity's role, and how do we prepare society for such a significant shift?""","In a world with superintelligent AI, what is humanity's role and how do we prepare society for this shift?",Superintelligent AI,Humanity's Role,Humanity's Role in the Age of Superintelligent AI
"Bias and Discrimination: ""AI systems have been shown to inherit biases from their training data. In the context of surveillance and social scoring, how can we prevent these systems from perpetuating or even exacerbating social inequalities and discrimination?""",How can AI surveillance systems prevent perpetuating social inequalities and discrimination?,AI in Surveillance,Bias and Discrimination,Preventing Bias and Discrimination in AI Surveillance
"Personal Accountability: ""As an expert who advocates for the use of AI in critical decision-making areas, how do you address personal accountability when these systems fail? Should developers, companies, or the AI itself bear the responsibility for mistakes, and how should victims be compensated?""",How should personal accountability and compensation be addressed when AI systems fail in critical decision-making areas?,AI Decision-Making in Critical Areas,Personal Accountability,Personal Accountability in AI Decision-Making
"Ethical Boundaries: ""Given the power of AI to influence public opinion and behavior, where do you draw the line between persuasion and manipulation? How do you propose we enforce these boundaries in practice?""","Where should the boundary be drawn between persuasion and manipulation in AI's influence on public opinion and behavior, and how can we enforce it?",AI-Driven Social Manipulation,Ethical Boundaries,Ethical Boundaries in AI Influence
"Historical Data vs. Future Orientation: ""Critics argue that AI's reliance on historical data not only perpetuates past injustices but also lacks imagination for a more equitable future. How do you propose we reconcile this inherent tension between AI's backward-looking data analysis and the need for forward-thinking, inclusive solutions?""","How can we reconcile the tension between AI's reliance on historical data and the need for forward-thinking, inclusive solutions in addressing bias?",Bias in AI,Bias in AI,Reconciling AI's Historical Bias with Forward-Thinking Solutions
"Transparency and Public Trust: ""Given the secretive nature of military technologies, how can the public be assured that the development and deployment of autonomous weapon systems are being conducted responsibly and ethically?""",How can the public trust the responsible and ethical development and deployment of autonomous weapon systems?,Autonomous Weapons Systems,Transparency and Public Trust,Transparency in Autonomous Weapon Systems
"Accountability and Transparency: ""In light of numerous studies showing AI systems perpetuating racial, gender, and socioeconomic biases, how do you justify the continued deployment of these technologies in critical areas such as law enforcement, hiring, and lending? What measures do you believe are necessary to ensure accountability and transparency in AI development and application?""","How can we ensure accountability and transparency in AI development and application to address biases in critical areas like law enforcement, hiring, and lending?",Bias in AI,Accountability and Transparency,Accountability and Transparency in AI Deployment
"Ethical Considerations and Human Context: ""AI systems frequently struggle to grasp the nuances of complex human contexts, leading to potentially life-altering errors. How can developers ensure that AI systems are ethically aligned and capable of understanding the depth of human conditions they're making decisions about?""",How can developers ensure that AI systems understand and make ethical decisions in complex human contexts?,AI Decision-Making in Critical Areas,Ethical Considerations and Human Context,Ethical Alignment in AI Decision-Making
